Sr No,Podcast Guest,Company Name,Company Description,Level 1 Tags,Level 2 Tags,Level 3 Tags,Level 4 Tags,Frameworks,CEO Summary
1,Ada Chen Rekhi,Notejoy,Fast focused collaborative notes app for individuals and teams,"Leadership & Management, Career & Organization","Leadership Development, Decision-Making & Judgment, Stakeholder & Influence, Career Navigation & Growth","Coach, Founder, IC","Human Judgment, Narrative Thinking","Curiosity Loops, Values Exercise",Learn Curiosity Loops for contextual advice gathering and frameworks for intentional early career building through exploration and exploitation.
2,Adam Fishman,Patreon,Creator monetization platform enabling sustainable income through memberships,"Leadership & Management, Career & Organization, Growth & Acquisition","Leadership Development, Hiring & Talent, Growth Strategy & Frameworks, Activation & Onboarding, Retention & Engagement","Scale Up, IC, Manager","Compounding Leverage, First Principles","Growth Competency Model, PMF for Candidates",Master the Growth Competency Model for hiring and learn why onboarding optimization drives retention and how to evaluate company fit using People Mission Financials framework.
3,Adam Grenier,Masterclass,Premium subscription platform for celebrity taught online courses,"Growth & Acquisition, Retention & Monetization, Go-To-Market","Growth Strategy & Frameworks, Growth Channels & Acquisition, Pricing & Economics, Positioning & Messaging, Product Marketing","Scale Up, B2C","Trade Offs, Systems Thinking","Emerging Channels Framework, Growth CMO DNA",Understand when to test emerging growth channels and distinguish Growth CMOs from traditional marketing leaders in subscription businesses.
4,Adriel Frederick,Reddit,Community driven content platform with user generated discussions and voting,"Career & Organization, Growth & Acquisition, Retention & Monetization","Org Design & Structure, Culture & Team Building, Growth Strategy & Frameworks, Marketplace Dynamics, Product Craft & Taste","Scale Up, Platform, Manager","Incentives, Second Order Effects",Growth Hacking Origins,Learn marketplace dynamics balancing supply demand and operational tools plus strategies for building diverse product teams that deliver business value.
5,"Aishwarya Reganti, Kiriti Badam",OpenAI,AI research and deployment company building foundation models and applications,AI Product Management,"AI Product Strategy & Leadership, AI Systems & Workflows","AI First, Early Stage","Systems Thinking, Human Judgment, Probabilistic Thinking","Agency Control Framework, AI Product Lifecycle",Understand core differences in building AI products including non deterministic interfaces and the critical agency control trade off requiring gradual trust building.
6,Albert Cheng,Grammarly,AI powered writing assistant for grammar clarity and tone improvement,"Growth & Acquisition, Retention & Monetization, Product Strategy","Growth Strategy & Frameworks, Monetization Strategy, Pricing & Economics, Product Strategy Development","B2C, Scale Up","Explore Exploit, Compounding Leverage",Explore Exploit Framework,Learn the explore exploit framework for finding growth opportunities and tactics for optimizing freemium conversion in consumer subscription products.
7,Alex Hardiman,New York Times,Premium digital news and journalism subscription service,"Leadership & Management, Product Strategy","Stakeholder & Influence, Product Strategy Development","B2C, Scale Up, Manager","Trade Offs, Narrative Thinking",,Understand unique challenges of product management in journalism balancing engagement metrics with editorial integrity and managing journalist stakeholder relationships.
8,Alex Komoroske,Google,Technology conglomerate with search advertising cloud and consumer products,"AI Product Management, Product Strategy","Product Vision & Narrative, Strategic Thinking & Frameworks, Product Strategy Development, Strategic Decision-Making, AI Product Strategy & Leadership","Scale Up, Platform, Manager","Systems Thinking, First Principles, Second Order Effects","Gardening vs Building Mindset, Strategy as Sensemaking",Grasp how LLMs fundamentally disrupt product development economics and learn systems thinking approaches for navigating complex organizational dynamics.
9,Alexander Embiricos,OpenAI,AI research and deployment company building foundation models and applications,AI Product Management,"AI Product Strategy & Leadership, AI Systems & Workflows","AI First, Early Stage, IC","Ready Fire Aim, Empirical Learning",,Learn OpenAI's bottoms up experimentation culture that prioritizes empirical learning over planning given rapid AI capability evolution and user behavior uncertainty.
10,Alisa Cohn,Executive Coaching,Professional coaching services for startup founders and Fortune 500 executives,"Leadership & Management, Career & Organization","Leadership Development, Coaching & Feedback, Stakeholder & Influence, Career Navigation & Growth","Coach, Founder, Manager","Human Judgment, Narrative Thinking",Difficult Conversations Framework,Master frameworks for conducting difficult conversations including performance feedback terminations and develop skills for managing emotional resistance to conflict.
11,Andy Johns,Wealthfront,Automated investment and wealth management platform for long term financial goals,"Leadership & Management, Career & Organization","Leadership Development, Career Navigation & Growth, Personal Effectiveness & Wellness","Manager, Founder, Crisis Mode","Human Judgment, Second Order Effects",,Understand the mental health toll of high achievement product and growth roles and pathways for recovery from burnout and changing life direction.
12,Andy Raskin,Strategic Narrative Consulting,Consulting services helping CEOs align teams around strategic narratives,"Go-To-Market, Product Strategy","Positioning & Messaging, Brand & Narrative, Product Strategy Development, Positioning & Differentiation","B2B, Scale Up","Narrative Thinking, First Principles",Strategic Narrative Framework,Learn the strategic narrative framework that aligns sales marketing product and fundraising by framing solutions around change not problems.
13,Anneka Gupta,Rubrik,Cloud data management and cyber resilience platform for enterprise backup recovery,"Leadership & Management, Product Strategy","Leadership Development, Coaching & Feedback, Strategic Thinking & Frameworks, Product Strategy Development","Enterprise, B2B, Manager, CPO","Trade Offs, Human Judgment",Being Strategic Framework,Master what it means to be strategic articulating compelling why behind decisions and championing hard but right long term changes.
14,Annie Duke,First Round Capital,Venture capital firm providing seed stage funding and founder support,"Leadership & Management, Product Strategy","Leadership Development, Coaching & Feedback, Decision-Making & Judgment, Product Strategy Development, Strategic Decision-Making","Investor, Manager","Probabilistic Thinking, Trade Offs, Second Order Effects","Thinking in Bets, Quit Framework",Learn decision making frameworks from poker including when to quit recognizing sunk costs and making better quick decisions despite long feedback loops.
15,Annie Pearl,Calendly,Scheduling automation platform enabling seamless meeting coordination,"Growth & Acquisition, Go-To-Market, Product Strategy","Product-Led Growth, Strategic Thinking & Frameworks, Product Strategy Development, GTM Strategy & Launch","B2B, Scale Up, CPO","Systems Thinking, Trade Offs",Playing to Win Framework,Understand product strategy as integrated set of choices defining where to play and how to win plus transition from PLG to sales led growth.
16,Anton Osika,Lovable,AI software engineer that builds complete products from natural language prompts,"Leadership & Management, Career & Organization, AI Product Management","Leadership Development, Founder & Executive Roles, Org Design & Structure, Hiring & Talent, AI Development Tools","AI First, Early Stage, Founder","Ready Fire Aim, First Principles",Minimum Lovable Product,Grasp how AI coding tools enable 15 person teams to scale to 10M ARR in months and the shift toward generalist product builders.
17,Anuj Rathi,Jupiter Money,Digital banking and wealth management app for Indian consumers,"Career & Organization, Product Strategy, Product Design","Org Design & Structure, Product Strategy Development, Working Backwards & Planning, Product Craft & Taste","B2C, Scale Up, Manager","First Principles, Systems Thinking, Trade Offs","Working Backwards Process, Three Divergent Directions",Learn product building for emerging markets the working backwards process and why teams should explore three divergent directions before converging on solutions.
18,April Dunford,Positioning Consulting,Consulting services specializing in B2B product positioning and sales pitch development,"Go-To-Market, Product Strategy","Positioning & Messaging, Product Strategy Development, Positioning & Differentiation","B2B, Scale Up","Narrative Thinking, First Principles","Obviously Awesome Positioning, Sales Pitch Framework",Master positioning driven sales pitch framework that moves beyond product demos to tell customer centric stories driving purchase decisions.
19,Ami Vora,Faire,B2B marketplace platform connecting independent retailers with wholesale brands,"Leadership & Management, Career & Organization, Growth & Acquisition","Leadership Development, Career Navigation & Growth, Growth Strategy & Frameworks, Marketplace Dynamics, Platform & Network Effects","B2B, Platform, Scale Up, CPO","Systems Thinking, Narrative Thinking, Compounding Leverage",,Learn marketplace platform development at scale career navigation by following exceptional leaders and using metaphors to drive product intuition.
20,Andrew Wilkinson,Tiny,Holding company acquiring and operating profitable internet businesses long term,"Leadership & Management, Career & Organization, Product Strategy","Leadership Development, Career Navigation & Growth, Personal Effectiveness & Wellness, Product Strategy Development","Founder, Investor","First Principles, Trade Offs, Human Judgment",Start Small Framework,Understand strategies for generating business ideas avoiding common traps and the relationship between money happiness and mental health management.
21,April Dunford,Positioning Consulting,Consulting services specializing in B2B product positioning and sales strategies,"Go-To-Market, Product Strategy","Positioning & Messaging, Product Strategy Development, Positioning & Differentiation","B2B, Scale Up","First Principles, Trade Offs",Obviously Awesome Positioning,Master positioning fundamentals including selecting market category defining competitive alternatives and articulating differentiated value to drive customer decisions.
22,Archie Abrams,Shopify,E commerce platform enabling merchants to build online stores and sell products,"Growth & Acquisition, Retention & Monetization, Product Strategy","Growth Strategy & Frameworks, Retention & Engagement, Product Vision & Narrative, Product Strategy Development, Product Craft & Taste","B2C, Platform, Scale Up, Manager","Second Order Effects, Systems Thinking, Compounding Leverage",100,Learn Shopify's unique approach banning core product KPIs using taste and long term vision while growth optimizes for churn reduction.
23,Arielle Jackson,First Round Capital,Venture capital firm providing seed stage funding and portfolio company support,"Career & Organization, Go-To-Market","Career Navigation & Growth, GTM Strategy & Launch, Positioning & Messaging, Product Marketing","B2C, Early Stage, Investor","Narrative Thinking, Human Judgment",,Understand brand and marketing fundamentals for early stage companies including naming philosophy hardware product launches and building marketing foundations.
24,Asha Sharma,Microsoft AI Platform,Enterprise AI infrastructure foundation models and agent toolchains for developers,"AI Product Management, Product Strategy","AI Product Strategy & Leadership, AI Systems & Workflows, Model Management & Evaluation, Product Strategy Development","AI First, Enterprise, Manager","Systems Thinking, Probabilistic Thinking, Second Order Effects",Product as Organism vs Artifact,Grasp shift from product as artifact to product as organism where AI systems continuously learn and adapt through interaction metabolism.
25,Austin Hay,Ramp,Corporate card and spend management platform with automated expense tracking,"Career & Organization, Growth & Acquisition, Product Design","Org Design & Structure, Growth Strategy & Frameworks, Product Craft & Taste","B2B, Scale Up, IC","Systems Thinking, Trade Offs",MarTech Maturity Model,Learn marketing technology fundamentals when to hire MarTech resources how to structure teams and balance first party vs third party tools.
26,Ayo Omojola,Carbon Health,Integrated healthcare platform combining primary care virtual visits and urgent care,"Growth & Acquisition, Retention & Monetization, Product Strategy","Growth Strategy & Frameworks, Pricing & Economics, Product Strategy Development, Positioning & Differentiation","B2C, Scale Up, Manager","Trade Offs, Compounding Leverage",Different and Better Framework,Understand consumer product differentiation requirement to be both different and better in ways that matter to end users.
27,Bangaly Kaba,YouTube,Video sharing platform with user generated content and creator monetization,"Career & Organization, Growth & Acquisition","Career Navigation & Growth, Growth Strategy & Frameworks","B2C, Platform, Scale Up, Manager","Compounding Leverage, Systems Thinking, First Principles",Impact as Input Framework,Learn to optimize career for impact as input with compensation as output plus growth tactics for billion user platforms.
28,Barbra Gago,Miro,Visual collaboration platform and online whiteboard for distributed teams,"Go-To-Market, Product Strategy","Positioning & Messaging, Brand & Narrative, Product Strategy Development, Positioning & Differentiation","B2B, Scale Up, Manager","Narrative Thinking, Systems Thinking",Category Creation Framework,Master when to pursue category creation versus existing categories and strategies for expanding market definitions beyond initial use cases.
29,Ben Horowitz,Andreessen Horowitz,Venture capital firm investing in technology companies across all stages,"Leadership & Management, Product Strategy","Leadership Development, Decision-Making & Judgment, Product Strategy Development, Strategic Decision-Making","Founder, Investor","Trade Offs, Second Order Effects, Human Judgment",The Hard Thing About Hard Things,Understand CEO decision making when all options are bad and why hesitation in face of difficult choices destroys organizations.
30,Ben Williams,Snyk,Developer security platform for finding and fixing code vulnerabilities automatically,"Growth & Acquisition, Retention & Monetization, Go-To-Market","Growth Strategy & Frameworks, Product-Led Growth, Content & Community Growth, Developer & B2B Growth, Pricing & Economics","B2B, Platform, Scale Up, Manager","Systems Thinking, Compounding Leverage",PLG to PLS Evolution,Learn developer focused PLG strategies community building tactics and evolution from product led growth to product led sales at scale.
31,Bob Moesta,The Rewired Group,Consulting firm applying Jobs to Be Done framework for product development,"Product Discovery, Product Strategy","Customer Research & Interviews, Jobs to Be Done, Product-Market Fit, Product Strategy Development","B2B, B2C, Early Stage","First Principles, Human Judgment, Second Order Effects","Jobs To Be Done, Forces of Progress",Master Jobs to Be Done framework understanding causation behind customer switching behavior and forces creating push pull anxiety and habit.
32,Andrew Bosworth Boz,Meta,Social media and technology conglomerate with Facebook Instagram and Reality Labs,"Leadership & Management, Product Strategy","Leadership Development, Product Vision & Narrative, Product Strategy Development","Platform, Scale Up, Manager","Systems Thinking, Second Order Effects, Compounding Leverage",,Learn lessons from creating Facebook Newsfeed and mobile ads plus technical leadership principles for building generational products at massive scale.
33,Brandon Chu,Shopify,E commerce platform enabling merchants to build online stores and sell products,"Career & Organization, Product Design","Career Navigation & Growth, Org Design & Structure, Product Craft & Taste","B2B, Platform, Scale Up, Manager","Systems Thinking, First Principles",,Understand platform and developer ecosystem product management plus career growth through domain expertise and technical depth.
34,Brendan Foody,Mercor,AI talent marketplace connecting experts with AI labs for model training and evals,"Growth & Acquisition, Retention & Monetization, AI Product Management","Growth Strategy & Frameworks, Marketplace Dynamics, Model Management & Evaluation, Product Strategy Development","AI First, Early Stage, Founder","Compounding Leverage, Systems Thinking, Ready Fire Aim",Value Chain Automation Framework,Grasp fastest growing company in history achieving 1 to 500M revenue in 17 months through AI training marketplace and eval infrastructure.
35,Bret Taylor,Sierra,AI agent platform for customer service and sales automation,"Leadership & Management, Career & Organization, AI Product Management","Leadership Development, Career Navigation & Growth, Personal Effectiveness & Wellness, AI Systems & Workflows, Product Operations & Delivery","AI First, Platform, Scale Up, Founder","First Principles, Trade Offs, Human Judgment",Daily Impact Framework,Learn product leadership principles from legendary builder who succeeded as APM engineer CTO CEO across Google Facebook Salesforce OpenAI.
36,Brian Balfour,Reforge,Professional development platform offering courses and insights for product and growth leaders,"Growth & Acquisition, Product Strategy","Growth Strategy & Frameworks, Growth Channels & Acquisition, Product Strategy Development","B2B, Scale Up, Founder","Trade Offs, Systems Thinking, Compounding Leverage",Growth Loops Framework,Understand how to choose and sequence growth channels plus principles for transitioning from education business to product company.
37,Benjamin Lauzier,Thumbtack,Local services marketplace connecting consumers with home service professionals,"Growth & Acquisition, Retention & Monetization, Product Strategy","Growth Strategy & Frameworks, Monetization Strategy, Marketplace Dynamics, Product Strategy Development","Marketplace, Scale Up, Manager","Systems Thinking, Trade Offs, Second Order Effects",Marketplace Liquidity Framework,Master marketplace fundamentals including liquidity measurement supply demand prioritization and avoiding common marketplace failure modes.
38,Bill Carr,Working Backwards LLC,Consulting firm teaching Amazon's working backwards and operational practices,"Career & Organization, Product Strategy, Product Design","Org Design & Structure, Hiring & Talent, Product Strategy Development, Working Backwards & Planning, Product Craft & Taste","B2B, B2C, Scale Up","First Principles, Systems Thinking, Trade Offs","Working Backwards Process, Input Output Metrics",Learn Amazon's working backwards process single threaded leadership and metric decomposition for building customer obsessed organizations.
39,Bob Baxley,ThoughtSpot,Analytics platform enabling natural language search and AI powered business intelligence,"Leadership & Management, Product Design","Leadership Development, Design Leadership & Operations, Product Craft & Taste, Design Philosophy & Culture","B2B, Enterprise, Manager","Human Judgment, First Principles, Compounding Leverage",Design Led Culture,Understand what design led culture truly means and principles from Apple for continuous improvement and quality obsession.
40,Bob Moesta,The Rewired Group,Consulting firm applying Jobs to Be Done framework for product and career development,"Career & Organization, Retention & Monetization, Product Discovery","Career Navigation & Growth, Job Search & Role Transitions, Hiring & Talent, Retention & Engagement, Jobs to Be Done","B2B, B2C, Manager, IC","Human Judgment, Trade Offs",Job Moves Framework,Learn tactical framework for finding jobs you love and hiring keeping amazing people through Jobs to Be Done lens.
41,Cameron Adams,Canva,Visual design and collaboration platform for creating graphics presentations and documents,"Leadership & Management, Growth & Acquisition, Product Strategy","Leadership Development, Stakeholder & Influence, Product-Led Growth, Product Vision & Narrative, Product Strategy Development","B2C, Platform, Scale Up, Founder","Systems Thinking, First Principles, Compounding Leverage",,Learn product led company building investor management and maintaining product focus at board level while scaling to hundreds of millions of users.
42,Camille Fournier,Two Sigma,Quantitative investment firm using data science and technology for trading strategies,"Leadership & Management, Career & Organization, Product Design","Leadership Development, Career Navigation & Growth, Org Design & Structure, Product Craft & Taste","Enterprise, Scale Up, Manager","Systems Thinking, Trade Offs",The Manager's Path,Master engineering leadership fundamentals platform engineering strategies and navigating technical management career from IC to executive.
43,Camille Hearst,Spotify,Audio streaming platform with music podcasts and creator monetization,"Retention & Monetization, Go-To-Market, Product Strategy","Monetization Strategy, Pricing & Economics, Product Marketing, Product Strategy Development","B2C, Platform, Manager","Trade Offs, Systems Thinking",,Understand creator platform product development fan monetization strategies and product marketing for consumer subscription businesses.
44,Camille Ricketts,Notion,All in one workspace combining docs databases wikis and project management,"Leadership & Management, Go-To-Market, Product Execution","Leadership Development, GTM Strategy & Launch, Positioning & Messaging, Content Marketing & PR, Product Marketing","B2B, Early Stage, Manager","Narrative Thinking, Compounding Leverage",First Round Review Content Strategy,Learn content led growth strategies startup marketing fundamentals and building brand through high quality content creation.
45,Carilu Dietrich,Atlassian,Team collaboration and productivity software including Jira Confluence and Trello,"Growth & Acquisition, Go-To-Market, Product Strategy","Growth Strategy & Frameworks, Growth Channels & Acquisition, Product Marketing, Product Strategy Development","B2B, Scale Up, Manager","Trade Offs, Second Order Effects, Compounding Leverage",Hypergrowth Playbook,Master hypergrowth company patterns when to hire sales teams channel transition strategies and why CMOs and CPOs get fired.
46,Carole Robin,Leaders in Tech,Non profit bringing Stanford interpersonal dynamics training to technology leaders,"Leadership & Management, Career & Organization","Leadership Development, Mental Models & Thinking, Career Navigation & Growth, Personal Effectiveness & Wellness","Manager, Founder, Coach","Human Judgment, First Principles","Touchy Feely Framework, Connect Principles",Learn interpersonal effectiveness relationship building and how childhood mental models limit leadership potential from Stanford's legendary course.
47,Casey Winters,Eventbrite,Event management and ticketing platform connecting organizers with attendees,"Growth & Acquisition, Retention & Monetization, Product Discovery","Growth Strategy & Frameworks, Growth Channels & Acquisition, Marketplace Dynamics, Product-Market Fit, Product Strategy Development","Marketplace, Scale Up, CPO","Systems Thinking, Trade Offs, Compounding Leverage",Growth Loops Framework,Understand marketplace growth strategies executive communication of trade offs and maintaining product market fit as CPO over multi year tenure.
48,Casey Winters,Eventbrite,Event management and ticketing platform connecting organizers with attendees,"Leadership & Management, Career & Organization, Retention & Monetization","Leadership Development, Founder & Executive Roles, Career Navigation & Growth, Job Search & Role Transitions, Retention & Engagement","Marketplace, Scale Up, CPO","Trade Offs, Human Judgment",Company Executive First Framework,Learn CPO role transition from product leader to business executive and maintaining role fit as company needs evolve over time.
49,Brian Chesky,Airbnb,Home sharing and travel experiences marketplace connecting hosts and guests globally,"Leadership & Management, Product Strategy, Product Design","Leadership Development, Founder & Executive Roles, Product Strategy Development, Product Craft & Taste","Marketplace, Platform, Scale Up, Founder","First Principles, Trade Offs, Human Judgment",Founder Mode Operating System,Master founder mode product development single company roadmap detail oriented leadership and organic growth over paid acquisition.
50,Brian Tolkin,Opendoor,Real estate technology platform enabling instant home buying and selling,"Career & Organization, Product Discovery, Product Strategy","Org Design & Structure, Jobs to Be Done, Product Strategy Development, Product Operations & Delivery, Product Rituals & Reviews","Marketplace, Scale Up, Manager","Systems Thinking, Trade Offs",Jobs To Be Done Implementation,Learn building products with heavy operational components product operations function and implementing Jobs to Be Done framework in practice.
51,Chris Hutchins,Wealthfront,Automated investment and financial planning platform with tax optimization features,"Career & Organization, Go-To-Market","Career Navigation & Growth, GTM Strategy & Launch","B2C, IC, Founder","Trade Offs, Compounding Leverage",Podcast Launch Playbook,Learn podcast launch and growth strategies financial product innovation and transitioning to independent creator path from PM role.
