Sr No,Podcast Guest,Company Name,Company Description,Level 1 Tags,Level 2 Tags,Level 3 Tags,Level 4 Tags,Frameworks,CEO Summary
52,Christian Idiodi,Silicon Valley Product Group,Product management consulting and coaching firm led by Marty Cagan,"Leadership & Management, Product Discovery","Leadership Development, Coaching & Feedback, Discovery Methods & Frameworks","B2B, Manager, Coach","Human Judgment, First Principles, Deliberate Practice",Product Trust Framework,Master building trust as PM through deep customer business and data knowledge plus coaching techniques for developing product talent.
53,Christina Wodtke,Stanford GSB,Business school teaching product management game design and entrepreneurship,"Career & Organization, Product Strategy, Product Design","Org Design & Structure, Strategic Thinking & Frameworks, Product Strategy Development, Product Craft & Taste","B2B, B2C, Manager","Trade Offs, Systems Thinking",OKR Framework,Learn the science of goal setting through OKRs balancing execution rigor with team empowerment and avoiding common implementation traps.
54,Claire Butler,Figma,Collaborative design tool for teams to create prototype and gather feedback,"Growth & Acquisition, Go-To-Market, Product Execution","Growth Strategy & Frameworks, Product-Led Growth, Content & Community Growth, Product Marketing, Product Rituals & Reviews","B2B, Scale Up, Manager","Narrative Thinking, Compounding Leverage",Figma GTM Playbook,Understand Figma's legendary bottoms up growth engine including early community seeding and product marketing that speaks to designers.
55,Claire Hughes Johnson,Stripe,Global technology company building economic infrastructure for the internet,"Leadership & Management, Career & Organization, Growth & Acquisition","Leadership Development, Org Design & Structure, Hiring & Talent, Product Strategy Development, Growth Strategy & Frameworks","B2B, Scale Up, Manager","Systems Thinking, First Principles, Second Order Effects",Scaling People Framework,Master the operating systems for scaling companies including hiring for values creating operational cadences and managing high growth teams.
56,Dan Hockenmaier,Faire,B2B marketplace platform connecting independent retailers with wholesale brands,"Growth & Acquisition, Retention & Monetization, Product Strategy","Growth Strategy & Frameworks, Retention & Engagement, Marketplace Dynamics, Product Strategy Development","B2B, Marketplace, Scale Up","Systems Thinking, First Principles, Compounding Leverage",Retention Loop Framework,Learn how to build durable growth models for marketplaces focusing on retention loops over acquisition and expanding into adjacent categories.
57,Daniel Ek,Spotify,Audio streaming platform with music podcasts and creator monetization,"Leadership & Management, Product Strategy","Leadership Development, Product Vision & Narrative, Product Strategy Development","B2C, Platform, Scale Up, Founder","First Principles, Systems Thinking, Probabilistic Thinking",The Spotify Model (Evolution),Understand Spotify's evolution from music to audio platform and leadership principles for maintaining innovation speed at massive scale.
58,David Sacks,Craft Ventures,Venture capital firm investing in B2B SaaS and marketplace startups,"Go-To-Market, Product Strategy","Product Strategy Development, GTM Strategy & Launch","B2B, Enterprise, Investor","First Principles, Trade Offs, Second Order Effects",The SaaS Playbook,Master the core metrics and operating playbooks for B2B SaaS companies including efficient growth and the transition to product led sales.
59,Deb Liu,Ancestry,Global leader in family history and consumer genomics,"Leadership & Management, Career & Organization, Product Strategy","Leadership Development, Stakeholder & Influence, Career Navigation & Growth, Personal Effectiveness & Wellness, Product Vision & Narrative","B2C, Scale Up, CEO","Human Judgment, Narrative Thinking",Take Back Your Power Framework,Learn how to build influence and resilience in your career navigating office politics and leading product organizations as a woman in tech.
60,Chip Huyen,Claypot AI,Real time machine learning platform for building and deploying AI features,"AI Product Management, Product Strategy","Model Management & Evaluation, Product Strategy Development","AI First, Early Stage, Founder","Systems Thinking, First Principles, Trade Offs",Real Time ML Blueprint,Master the shift from batch to real time machine learning understanding feature stores model evaluation and the infrastructure required for responsive AI products.
61,Dalton Caldwell,Y Combinator,Startup accelerator providing funding mentorship and network to early stage companies,"Leadership & Management, Career & Organization, Product Discovery","Leadership Development, Career Navigation & Growth, Personal Effectiveness & Wellness, Pivots & Validation, Product Strategy Development","Early Stage, Founder","Perseverance, Human Judgment, Trade Offs",YC Startup Playbook,Master startup fundamentals of not giving up selling making money talking to customers and knowing when to pivot from YC partner who's seen thousands of startups.
62,Dan Hockenmaier,Faire,B2B wholesale marketplace connecting independent retailers with brands,"Growth & Acquisition, Retention & Monetization, Product Strategy","Growth Strategy & Frameworks, Marketplace Dynamics, Platform & Network Effects, Product Strategy Development","Marketplace, Scale Up, Manager","Systems Thinking, Second Order Effects, Compounding Leverage",Marketplace Growth Model Framework,Learn marketplace as ecosystem requiring light touch gardening approach plus growth modeling strategies from someone who's built dozens of marketplaces.
63,Dan Shipper,Every,AI powered media company with newsletter products consulting and AI workflows,"Career & Organization, AI Product Management, Product Design","Org Design & Structure, Personal Effectiveness & Wellness, AI Product Strategy & Leadership, AI Systems & Workflows, AI Development Tools","AI First, Early Stage, Founder","Ready Fire Aim, Systems Thinking",AI Native Company Blueprint,Understand building AI native companies where engineers don't write code agents build products and teams achieve 10x productivity through systematic AI adoption.
64,David Placek,Lexicon Branding,Brand naming firm creating iconic product and company names,Go-To-Market,Positioning & Messaging,"B2B, B2C, Founder","First Principles, Narrative Thinking, Differentiation Thinking",Lexicon Naming Process,Master brand naming methodology understanding letter energy palindromes and why great names must feel uncomfortable before they feel right.
65,David Singleton,Stripe,Payment infrastructure platform for internet businesses and commerce,"Leadership & Management, Career & Organization, Product Execution","Leadership Development, Org Design & Structure, Culture & Team Building, Hiring & Talent, Product Operations & Delivery","B2B, Platform, Scale Up, Manager","Systems Thinking, First Principles, Deliberate Practice","Stripe Engineering Principles, Walking the Store",Learn Stripe's meticulous craft culture product minded engineering hiring for builders and operational processes like friction logging and engineer vacations.
66,Deb Liu,Ancestry,Genealogy and family history platform with DNA testing and records database,"Leadership & Management, Career & Organization","Leadership Development, Career Navigation & Growth, Personal Effectiveness & Wellness","B2C, Platform, Scale Up, CEO","Perseverance, Human Judgment, Trade Offs",PM Your Career Framework,Master career management as product treating yourself as product to manage building resilience and succeeding as introvert in business.
67,Dhanji Prasanna,Block,Financial services and digital payments platform including Square and Cash App,"Career & Organization, AI Product Management, Product Design","Org Design & Structure, Culture & Team Building, Personal Effectiveness & Wellness, AI Product Strategy & Leadership, AI Development Tools","B2B, B2C, Platform, Scale Up","Systems Thinking, Ready Fire Aim",AI Native Transformation,Learn transforming large company to AI native achieving 8-10 hour weekly productivity gains through internal agents and cultural shifts.
68,Dharmesh Shah,HubSpot,Inbound marketing sales and CRM platform with product led growth motion,"Leadership & Management, Career & Organization, Retention & Monetization","Leadership Development, Executive Communication, Culture & Team Building, Personal Effectiveness & Wellness, Retention & Engagement","B2B, Platform, Scale Up, Founder","Human Judgment, Systems Thinking, Narrative Thinking","HubSpot Culture Code, Laughs Per Minute",Understand building and scaling company culture from introvert founder perspective maintaining startup mentality in public company.
69,Claire Vo,LaunchDarkly,Feature management and experimentation platform for engineering teams,"Leadership & Management, Career & Organization, Product Design","Leadership Development, Org Design & Structure, Product Craft & Taste","B2B, Platform, Scale Up, CPO","Systems Thinking, First Principles",Startup Mode at Scale,Learn operating like startup at scale building PM AI tools on side and transitioning between engineering design product and marketing roles.
70,Crystal Widjaja,Gojek,Southeast Asian super app offering ride hailing delivery and financial services,"Growth & Acquisition, Product Strategy","Growth Strategy & Frameworks, Product Strategy Development","B2C, Platform, Scale Up, Manager","Systems Thinking, Compounding Leverage, Trade Offs",Consumer Growth Playbook,Master consumer growth unlocks growth modeling best practices analytics implementation and structuring growth teams in emerging
71,Donna Lichaw,Executive Coaching,Leadership coaching and storytelling consultancy for founders and executives,"Leadership & Management, Career & Organization","Leadership Development, Coaching & Feedback, Career Navigation & Growth","Founder, CEO, Coach","Narrative Thinking, Human Judgment",The Leader's Journey,Master leadership through story frameworks helping founders scale impact while staying true to mission and purpose.
72,Drew Houston,Dropbox,Cloud storage and file collaboration platform for teams and individuals,"Leadership & Management, Product Discovery, Product Strategy","Leadership Development, Founder & Executive Roles, Pivots & Validation, Product Strategy Development","B2B, B2C, Platform, Scale Up, Founder","Perseverance, Trade Offs, Human Judgment",Dropbox Transformation Story,Learn navigating 18 year founder journey including competing with big tech product pivots crisis management and company transformation.
73,Dylan Field,Figma,Collaborative design platform for interface and product design teams,"Leadership & Management, Product Strategy, Product Design","Leadership Development, Product Vision & Narrative, Product Strategy Development, Product Craft & Taste","B2B, Platform, Scale Up, Founder","First Principles, Systems Thinking, Narrative Thinking","Detach Program, Figma Make Vision",Understand recovering from failed Adobe acquisition developing product taste launching new product lines and evolving as leader over 13 years.
74,Dylan Field,Figma,Collaborative design platform for interface and product design teams,"Leadership & Management, Product Design","Leadership Development, Executive Communication, Product Craft & Taste","B2B, Platform, Scale Up, Founder","Narrative Thinking, Systems Thinking",,Learn Figma's approach to product development culture and live product demonstrations at scale from CEO perspective.
75,Ebi Atawodi,YouTube,Video sharing platform with user generated content and creator monetization,"Product Strategy, Product Design","Product Vision & Narrative, Product Strategy Development, Product Craft & Taste","B2C, Platform, Scale Up, Manager","First Principles, Narrative Thinking, Alignment","Vision Framework, Product Vision Template",Master four part vision framework lofty realistic problem grounded devoid of tech limitations plus tactical vision communication techniques.
76,Edwin Chen,Surge AI,AI data labeling and training company powering frontier AI labs,"Leadership & Management, AI Product Management, Product Strategy","Leadership Development, Stakeholder & Influence, Model Management & Evaluation, Product Strategy Development","AI First, Early Stage, Founder","First Principles, Trade Offs",Bootstrapped AI Company Blueprint,Learn building fastest company to 1B revenue 100 employees bootstrapped profitable day one powering every frontier AI lab.
77,Eeke de Milliano,Retool,Low code platform for building internal tools and business applications,"Leadership & Management, Career & Organization, Product Design","Leadership Development, Org Design & Structure, Product Craft & Taste","B2B, Platform, Scale Up, Manager","Systems Thinking, First Principles, Deliberate Practice",Stripe Innovation Principles,Understand Stripe's culture fostering innovation right amount of process by stage and building diversified talent portfolio.
78,Elena Verna,Amplitude,Product analytics platform for measuring user behavior and experimentation,"Growth & Acquisition, Product Strategy","Growth Strategy & Frameworks, Product-Led Growth, Product Strategy Development","B2B, Platform, Scale Up, Manager","Systems Thinking, Trade Offs, Compounding Leverage",Elena's Growth Frameworks,Master growth strategy frameworks interim leadership approach and PLG experimentation from legendary growth advisor and instructor.
79,Elena Verna,Lovable,AI software engineer that builds complete products from natural language prompts,"Growth & Acquisition, AI Product Management, Product Discovery","Growth Strategy & Frameworks, Product-Market Fit, Pivots & Validation, Product Strategy Development, AI Product Strategy & Leadership","AI First, Early Stage, Manager","Ready Fire Aim, Systems Thinking, Compounding Leverage","AI Growth Playbook, PMF Recapture Model",Grasp new growth playbook for AI companies achieving 200M ARR in under year and how PMF must be recaptured every 3 months.
80,Dmitry Zlokazov,Revolut,Financial super app offering banking crypto investing and mortgages globally,"Leadership & Management, Career & Organization, Product Execution","Leadership Development, Career Navigation & Growth, Org Design & Structure, Hiring & Talent, Personal Effectiveness & Wellness","B2C, Platform, Scale Up, Manager","First Principles, Human Judgment, Perseverance",Product Owner Model,Learn Revolut's approach producing best PMs through ownership complex problems hiring smart early career talent and execution focus.
81,Elizabeth Stone,Netflix,Streaming entertainment platform with original content and global subscriber base,"Leadership & Management, Career & Organization, Product Design","Leadership Development, Coaching & Feedback, Org Design & Structure, Hiring & Talent, Product Craft & Taste","B2C, Platform, Scale Up, CTO","First Principles, Human Judgment, Systems Thinking","Netflix Culture Code, Freedom and Responsibility",Learn Netflix's unique culture of talent density radical candor freedom responsibility and data organization from first economist CTO at Fortune 500.
82,Emilie Gerber,Six Eastern,PR and communications agency for tech companies from stealth to public,"Go-To-Market, Product Strategy","Content Marketing & PR, Product Strategy Development","B2B, B2C, Early Stage, Founder","Narrative Thinking, Human Judgment",PR Playbook,Master tactical PR strategies getting press coverage crafting effective pitches and building awareness for startups and tech companies.
83,Emily Kramer,Marketing Advisor,Marketing consultant and investor focused on B2B SaaS marketing teams,"Go-To-Market, Product Strategy","GTM Strategy & Launch, Product Marketing, Product Strategy Development","B2B, Early Stage, Investor","Systems Thinking, Compounding Leverage",First Marketer Playbook,Understand building marketing functions from scratch as first marketer at multiple B2B startups from 30 to 300 person scale.
84,Lenny Rachitsky,Lenny's Newsletter,Product and growth newsletter podcast and community for product professionals,"Go-To-Market, Product Execution","Positioning & Messaging, Product Rituals & Reviews","B2B, Founder","Narrative Thinking, Systems Thinking",April Dunford Positioning Framework,Review of podcast first 50 episodes covering positioning fundamentals competitive alternatives and value themes from expert guests.
85,Eric Ries,Long Term Stock Exchange,Stock exchange designed for companies focused on long term value creation,"Leadership & Management, Career & Organization, Product Discovery","Leadership Development, Personal Effectiveness & Wellness, Pivots & Validation, Product Strategy Development","Early Stage, Founder","First Principles, Trade Offs, Perseverance","Lean Startup Methodology, Pivot Framework",Master Lean Startup methodology understanding pivots founder wellbeing and building companies aligned with long term values not just exits.
86,Eric Simons,StackBlitz,Browser based development environment and AI coding platform with Bolt product,"AI Product Management, Product Discovery, Product Strategy","AI Development Tools, Pivots & Validation, Product Strategy Development","AI First, Early Stage, Founder","Perseverance, Ready Fire Aim, Compounding Leverage",Seven Year Overnight Success,Learn fastest growing AI product story pivoting from near death to 40M ARR in 4 months through seven years of infrastructure building.
87,Ethan Evans,Executive Coaching,Leadership coaching and course creation for aspiring executives and senior leaders,"Leadership & Management, Career & Organization","Leadership Development, Coaching & Feedback, Career Navigation & Growth","Manager, Coach","Human Judgment, Systems Thinking, Deliberate Practice",The Magic Loop Framework,Master advancing to executive roles through Amazon leadership principles Magic Loop framework and tactical career development strategies.
88,Ethan Smith,Graphite,SEO platform and consulting for modern SEO in AI era,"Growth & Acquisition, Go-To-Market, AI Product Management","Growth Strategy & Frameworks, Content & Community Growth, GTM Strategy & Launch, AI Product Strategy & Leadership","B2B, Early Stage, Founder","First Principles, Systems Thinking","Product Led SEO, AI Era SEO",Understand SEO transformation with rise of LLMs ChatGPT Perplexity and how to win at SEO in AI powered search era.
89,Elena Verna,Growth Advisor,Growth consultant instructor and interim leader for B2B SaaS companies,"Growth & Acquisition, Product Strategy","Growth Strategy & Frameworks, Product Strategy Development","B2B, Manager, Investor","Systems Thinking, Trade Offs",Growth Anti Patterns Framework,Learn 10 growth strategies that never work yet companies invest in plus favorite frameworks from legendary B2B growth expert.
90,Eli Schwartz,SEO Consulting,SEO strategy consulting for growth stage tech companies,"Growth & Acquisition, Go-To-Market","Growth Strategy & Frameworks, Content & Community Growth, GTM Strategy & Launch","B2B, Early Stage","First Principles, Systems Thinking",Product Led SEO Framework,Master product led SEO approach understanding how AI chatbots and Google changes affect SEO strategy and execution.
91,Garrett Lord,Handshake,College recruiting platform and AI training data business for students and employers,"AI Product Management, Product Strategy","Model Management & Evaluation, Product Strategy Development","AI First, Platform, Scale Up, Founder","First Principles, Ready Fire Aim, Compounding Leverage",Zero to 100M in 12 Months,Learn building 50M ARR AI business in 4 months by self disrupting decade old platform leveraging student network for training data.
92,Gaurav Misra,Captions,AI powered video creation and editing app for generating talking head videos,"Career & Organization, AI Product Management, Product Strategy","Org Design & Structure, Product Strategy Development, Roadmapping & Prioritization, Velocity & Speed, Design Engineering & Tools","B2C, AI First, Early Stage, Founder","Ready Fire Aim, Systems Thinking","Ship Weekly Framework, Snap Product Model",Master AI consumer product development shipping weekly marketable features secret roadmaps and design led engineering from Snap veteran.
93,Geoff Charles,Ramp,Finance automation platform and corporate card for business expense management,"Career & Organization, Product Strategy, Product Execution","Org Design & Structure, Culture & Team Building, Product Strategy Development, Strategic Decision-Making, Velocity & Speed","B2B, Platform, Scale Up, Manager","First Principles, Systems Thinking, Deliberate Practice",Fastest SaaS Growth Playbook,Understand building fastest growing SaaS to 100M ARR in 2 years with 50 people through velocity culture and high bar.
94,Geoffrey Moore,Consulting,Author of Crossing the Chasm and advisor on technology adoption and GTM strategy,"Go-To-Market, Product Strategy","Product Strategy Development, GTM Strategy & Launch","B2B, Early Stage, Investor","First Principles, Systems Thinking, Differentiation Thinking","Crossing the Chasm Playbook, Bowling Pin Strategy",Master go to market fundamentals from chasm crossing to bowling pins understanding why narrow focus beats broad approach for adoption.
95,Gergely Orosz,Pragmatic Engineer,Technology newsletter and content platform for engineering professionals,"Career & Organization, Go-To-Market","Career Navigation & Growth, Content Marketing & PR","B2B, Founder","Compounding Leverage, Systems Thinking",Newsletter Creator Playbook,Learn building top tech newsletter full time including decision to leave tech transitioning to creator and Substack growth strategies.
96,Evan LaPointe,CORE Sciences,Neuroscience based consulting teaching how brains work for better products and decisions,"Leadership & Management, Product Strategy","Leadership Development, Decision-Making & Judgment, Mental Models & Thinking, Product Strategy Development, Strategic Decision-Making","B2B, Founder, Coach","Human Judgment, First Principles",Brain Departments Framework,Understand neuroscience of decision making using brain departments metaphor to build better products teams and make smarter choices.
97,Lenny Rachitsky,Lenny's Podcast,Compilation episode on failure stories from past podcast guests,Leadership & Management,"Leadership Development, Decision-Making & Judgment","B2B, B2C","Human Judgment, Perseverance",Failure Compilation Insights,Learn from curated failure stories across product leaders understanding importance of listening before acting and course correcting quickly.
98,Fareed Mosavat,Reforge,Professional development platform for product and growth leaders,"Leadership & Management, Career & Organization, Growth & Acquisition","Leadership Development, Career Navigation & Growth, Org Design & Structure, Growth Strategy & Frameworks","B2B, Manager","Systems Thinking, Deliberate Practice",Growth Team Building Framework,Master building growth teams career transitions across growth product roles and multi domain expertise from Instacart Zynga Pixar veteran.
99,Farhan Thawar,Shopify,E commerce platform enabling merchants to build online stores and sell products,"Leadership & Management, Career & Organization, Product Execution","Leadership Development, Org Design & Structure, Culture & Team Building, Velocity & Speed, Product Craft & Taste","B2B, Platform, Scale Up, Manager","First Principles, Deliberate Practice, Systems Thinking","Choose the Harder Option, Shopify Eng Culture",Learn maintaining velocity at 10K remote employees through pair programming choosing hard path canceling meetings and thousand person intern programs.
100,Fei-Fei Li,World Labs,AI research and world model company building spatial intelligence for AI systems,"Leadership & Management, AI Product Management, Product Strategy","Leadership Development, Product Strategy Development, AI Product Strategy & Leadership","AI First, Founder, Research","First Principles, Systems Thinking","ImageNet Innovation, World Models",Understand AI history from ImageNet breakthrough to world models learning from godmother of AI about spatial intelligence and humanity's future.
101,Graham Weaver,Alpine Investors,Private equity firm focused on software and services businesses,"Leadership & Management, Career & Organization, Product Strategy","Leadership Development, Career Navigation & Growth, Personal Effectiveness & Wellness, Product Strategy Development, Strategic Decision-Making","Founder, Investor, Coach","Human Judgment, First Principles, Narrative Thinking",Life Design Framework,Master getting off autopilot designing life with intentionality and managing growing enterprises from top performing PE founder and Stanford professor.
102,Grant Lee,Gamma,AI powered presentation creation platform for creating decks with natural language,"Growth & Acquisition, Retention & Monetization, AI Product Management","Growth Strategy & Frameworks, Content & Community Growth, Pricing & Economics, AI Product Strategy & Leadership","AI First, Early Stage, Founder","Ready Fire Aim, Systems Thinking, Compounding Leverage",Profitable AI Playbook,Learn building profitable AI startup serving 50M users with 30 person team through influencer marketing pricing strategy and durable product.
103,Gustaf Alstromer,Y Combinator,Startup accelerator providing funding mentorship and network to early stage companies,"Growth & Acquisition, Product Strategy","Growth Strategy & Frameworks, Product Strategy Development","Early Stage, Manager, Investor","Systems Thinking, Compounding Leverage, First Principles",Airbnb Growth Playbook,Understand building original Airbnb growth team YC group partner insights and driving climate tech investment ecosystem from early Airbnb growth lead.
